{
  "format": "ostudy-flashcards",
  "formatVersion": 1,
  "deck": {
    "mode": "create",
    "name": "Stage 3.12 generated-import conformance",
    "description": "Disposable automated conformance deck"
  },
  "defaultTags": [
    "Conformance",
    "Stage 3.12"
  ],
  "cards": [
    {"type":"basic","front":"Plain ASCII question","back":"Plain ASCII answer"},
    {"type":"basic","front":"Café naïve résumé — Ελληνικά — 中文 — 😀","back":"Unicode survives"},
    {"type":"basic","front":"2 < 3 and 5 > 4","back":"Comparison symbols remain literal text"},
    {"type":"basic","front":"# Heading level 1","back":"H1"},
    {"type":"basic","front":"## Heading level 2","back":"H2"},
    {"type":"basic","front":"### Heading level 3","back":"H3"},
    {"type":"basic","front":"#### Heading level 4","back":"H4"},
    {"type":"basic","front":"**bold asterisks** and __bold underscores__","back":"Bold"},
    {"type":"basic","front":"*italic asterisk* and _italic underscore_","back":"Italic"},
    {"type":"basic","front":"~~strikethrough~~","back":"Strike"},
    {"type":"basic","front":"Inline code: `<tag> ![not-image](x) | pipe |`","back":"Inline code literal syntax"},
    {"type":"basic","front":"```html\n<script>alert('literal')</script>\n![not-image](x)\n| A | B |\n```","back":"Fenced code literal syntax"},
    {"type":"basic","front":"```rust\nfn main() {\n    println!(\"hello\");\n}\n```","back":"Fenced code language"},
    {"type":"basic","front":"> first quoted line\n> second quoted line","back":"Block quote"},
    {"type":"basic","front":"- alpha\n- beta","back":"Dash bullet list"},
    {"type":"basic","front":"* alpha\n* beta","back":"Asterisk bullet list"},
    {"type":"basic","front":"+ alpha\n+ beta","back":"Plus bullet list"},
    {"type":"basic","front":"1. first\n2. second","back":"Ordered list one"},
    {"type":"basic","front":"7. seventh\n8. eighth","back":"Ordered list custom start"},
    {"type":"basic","front":"Before\n\n---\n\nAfter","back":"Horizontal rule dashes"},
    {"type":"basic","front":"Before\n\n***\n\nAfter","back":"Horizontal rule asterisks"},
    {"type":"basic","front":"Before\n\n___\n\nAfter","back":"Horizontal rule underscores"},
    {"type":"basic","front":"Line one\nLine two","back":"Hard line break in paragraph"},
    {"type":"basic","front":"[HTTP](http://example.com/path)","back":"HTTP link"},
    {"type":"basic","front":"[HTTPS](https://example.com/path?q=1#frag)","back":"HTTPS link"},
    {"type":"basic","front":"[Mail](mailto:nurse@example.com)","back":"Mail link"},
    {"type":"basic","front":"[Call](tel:+12065550100)","back":"Telephone link"},
    {"type":"basic","front":"Quotes \"double\" and 'single', braces {x}, brackets [x], slash \\","back":"Punctuation"},
    {"type":"basic","front":"What reverses warfarin?","back":"Vitamin K","reverseEnabled":true,"tags":["Reverse","Medication"]},
    {"type":"basic","front":"What is metoprolol?","back":"A beta blocker","tags":["Medication","β-blocker"," medication "]},
    {"type":"basic","front":"Paragraph one.\n\nParagraph two.\n\nParagraph three.","back":"Multiple paragraphs"},
    {"type":"basic","front":"   padded question   ","back":"   padded answer   "},
    {"type":"cloze","text":"The {{c1::sinoatrial node}} is the normal pacemaker."},
    {"type":"cloze","text":"The heart has {{c1::four}} chambers and {{c2::two}} atria.","mode":"one_at_a_time"},
    {"type":"cloze","text":"Give {{c2::oxygen}} before {{c1::transport}} when indicated.","mode":"one_at_a_time"},
    {"type":"cloze","text":"{{c1::ACE inhibitors}} may cause {{c1::cough}}.","mode":"one_at_a_time"},
    {"type":"cloze","text":"A {{c1::beta blocker}} can {{c2::lower heart rate}}.","mode":"all_together"},
    {"type":"cloze","text":"{{c1::β₁ receptors}} are expressed in the {{c2::心臓}}.","mode":"one_at_a_time","tags":["Unicode"]},
    {"type":"cloze","text":"{{c1::A}}{{c2::B}} are adjacent markers.","mode":"one_at_a_time"},
    {"type":"cloze","text":"Maximum group {{c10000::valid}}.","mode":"one_at_a_time"},
    {"type":"cloze","text":"Line one has {{c1::alpha}}.\nLine two has {{c2::beta}}.","mode":"all_together"}
  ]
}
